{
  "providerId": "ollama",
  "displayName": "Ollama",
  "fields": [
    {
      "id": "baseUrl",
      "labelKey": "provider.field.baseUrl",
      "type": "url",
      "required": true,
      "defaultValue": "http://localhost:11434/v1"
    }
  ],
  "modelDiscovery": {
    "method": "POST",
    "path": "/providers/ollama/models",
    "refreshButton": true
  },
  "testConnection": {
    "method": "POST",
    "path": "/providers/ollama/test",
    "stages": [
      "config",
      "network",
      "model"
    ]
  },
  "ui": {
    "categoryTabs": [
      "Local"
    ],
    "guideKey": "provider.guide.ollama",
    "reserved": true
  }
}
